name,product_url,sku,price,summary,description,features,specs_json,image_urls,source_url,category_id,view_count,unused
Máy in UV phẳng KM-1612,https://vprintmachinery.com/san-pham/may-in-uv-phang-km1612-170.html, KM-2513,Giá: Liên hệ,"May in Colmar KM-1612 sản xuất và lắp ráp theo tiêu chuẩn cao nhất với các phụ tùng và bộ phận chính từ Nhật, Đức phù hợp các ứng dụng công nghiệp in trên mọi chất liệu, in gạch nem,in tủ nhựa, in kính,...Đầu in G5, G6","Máy in UV hiệu COLMAR| Máy in trên mọi chất liệu và bề mặt cho quảng cáo, trang trí nội thất và các ứng dụng công nghiệp khác VPrint xin giới thiệu dòng máy in UV dạng tấm flatbed hiệu Colmar. Máy được trang bị đầu in Ricoh công nghiệp thế hệ 5, có hệ thống gia nhiệt, hạt mực phun thay đổi từ 7pl đến 35pl nên dễ dàng đạt độ phân giải cao 720x1800dpi, đầu in bằng thép không rỉ có khả năng chống mài mòn cao nên có tuổi thọ lớn có thể lên đến 5 năm. Dòng máy in này với hệ cơ khí được chế tạo ở cấp chính xác cao lên đến mimicromet và được trang bị động cho secvo của Panasonic bền và chính xác nên cho hình ảnh in cực kỳ sắc nét và chính xác. Máy in UV KM-1612 dạng phẳng flatbed","Tại sao nên chọn máy in UV dạng tấm hiệu Colmar? - Đầu in công nghiệp thế hệ 5 của Ricoh bằng thép không rỉ cho tuổi thọ cao - Động cơ servo dẫn động của Panasonic (Nhật) cho phép điều khiển chính xác các chuyển động - Hệ thống đường ray đôi của THK Nhật giúp tăng độ ổn định và giảm độ ồn - Hệ thống xích dẫn dây từ Đức - Tự động định vị trí và chiều cao vật liệu cần in cho phép in lên đến cao đến 75 mm (hoặc 450mm nếu yêu cầu) - Đèn UV LED có hiệu suất cao và tuổi thọ bền hơn loại đèn UV thủy ngân thông thường - Nhiều màu- từ 4 đến 7 màu - Hệ thống sấy nhiệt cho bình mực chính, và sấy nhiệt tuần hoàn đầu in - Chốt định vị điều khiển bằng khí nén - Đồng hồ báo lượng mực còn lại trong bình chứa của từng màu mực - Hệ thống tự động chống va chạm để bảo vệ đầu in - Hệ thống khử tĩnh điện để in nhựa, mica,…(Tùy chọn) - Máy được trang bị bàn hút chân không để giữ ổn định vật liệu mỏng - Hệ thống áp suất âm giúp hình ảnh in sống động hơn đồng thời tiết kiệm mực in và bảo vệ đầu in - Máy có độ chính xác cao lên đến micromet cho phần cơ khí - Máy được thiết kế để có thể hoạt động 24/7","{""Model"": ""KM-1612"", ""Khích thước vùng in"": ""1600x1200mm"", ""Số đầu in"": ""từ 4-8 cái (cho 4 đến 8 màu)"", ""Chế độ in"": ""Một chiều/hai chiều"", ""Đầu in/Công nghệ in"": ""Ricoh Gen5/ Grey level Piezo"", ""Mực"": ""Lm, Lc, Y,M,C,K (tùy chọn)/Mục UV thân thiện môi trường (No VOC)"", ""Mực đặc biệt"": ""Mực UV trắng hoặc mực UV vecni"", ""Độ phân giải"": ""720x1800dpi"", ""Phần mềm"": ""PhotoPrint,ColorGate Rip 9"", ""File format"": ""Adobe Postcript level3, PDF, JPEG, TIFF, EPS, AI"", ""Chiều dầy vật liệu"": ""75mm"", ""Vật liệu có thể in"": ""đá, gỗ, vải, kim loại, thủy tinh... cứng và mềm"", ""Nguồn yêu cầu"": ""AC 220V, 50/60Hz, 5KW"", ""Kích thước máy (LxWxH), khối lượng"": ""3400x2080x1354mm, 1200Kg""}",https://vprintmachinery.com/upload/sanpham/km-1612-picture-5501.jpg,,,,
OKI_Pro9431dn,https://vprintmachinery.com/san-pham/OKIPro9431dn-151.html, OKI pro9431dn,Giá: Liên hệ,Máy in 4 màu A3+ cho chất lượng đầu ra chuyên nghiệp và vật liệu linh hoạt,"Pro9431dn được thiết kế để đáp ứng nhu cầu của ngành công nghiệp đồ họa sáng tạo và cũng rất phù hợp với các ứng dụng văn phòng nói chung, loại bỏ sự cần thiết của hai máy in. Được chế tạo để cung cấp các mức thiết yếu của đầu ra chất lượng cao, Pro9431dn mạnh mẽ và đáng tin cậy, là những yêu cầu chính trong các thị trường khó tính này. Ngoài ra, Pro9431dn cũng tương thích hoàn toàn với máy chủ EFI Fiery XF tùy chọn cho phép quản lý màu tiên tiến, bao gồm màu sắc tại chỗ và màu xử lý, tối ưu hóa độ sâu màu và chất lượng in.","Màu sắc với độ nét cao Pro9431dn sử dụng công nghệ LED kỹ thuật số và công nghệ ProQ đa cấp để tạo ra bản in sắc nét và sống động nhất hiện có. - Độ phân giải tuyệt vời 1200 x 1200dpi - Công nghệ in đa cấp ProQ giúp tăng cường độ in màu - Hoàn toàn tương thích với EFI Fiery® XF để quản lý màu nâng cao Tổng chi phí thấp Pro9431dn mang lại sự tiết kiệm chi phí đáng kể so với các máy in tương đương, kết hợp chi phí vốn cạnh tranh cao với hộp mực có dung lượng cực cao. - Chi phí vốn ban đầu cạnh tranh tốt - Giảm chi phí vận hành thông qua hộp mực và trống công suất cực cao - Tách riêng mực và trống để giảm lãng phí - Năng lượng hiệu quả nhằm giảm mức sử dụng năng lượng Tốc độ mà bạn có thể dựa vào Tốc độ in cao nhất trên thị trường với đầu ra độ nét cao tuyệt đẹp không thể đánh bại. -Thời gian cho bản in đầu tiên dưới 8s - Tốc độ in A3 là 28 trang/ phút bằng màu / đơn (lên tới 50trang/phút bằng màu /đơn cho A4) - Bộ nhớ RAM 2 GB và bộ xử lý 1.2GHz cho lưu lượng nhanh Vật liệu in linh hoạt có thể đánh bại các dòng máy khác Pro9431dn đánh bại các đối thủ cạnh tranh khi nói đến tính linh hoạt của vật liệu in, in hàng loạt các vật liệu trong nhà . - Khổ rộng giấy từ A6 đến SRA3 và chiều dài banner lên đến 1.3m - In trên giấy độ dày 360gsm 1 mặt và 320gsm 2 mặt - Sử dụng nhiều loại vật liệu bao gồm giấy bóng, phim, giấy chuyển nhiệt, không thấm nước và nhiều loại nữa. - Khay 530 tờ theo tiêu chuẩn, lên đến 2950 tờ với các khay tùy chọn - Khay vật liệu 300 tờ mang đến tính linh hoạt tốt nhất. - In 2 mặt theo tiêu chuẩn.",,"https://vprintmachinery.com/upload/hinhthem/pro9431frontvprint-8860.png, https://vprintmachinery.com/upload/hinhthem/pro9431frontwithmptopenvprint-4164.png, https://vprintmachinery.com/upload/hinhthem/pro9431heroleftvprint-1426.png, https://vprintmachinery.com/upload/hinhthem/pro9431with2ndtrayhcfvprint-86.png, https://vprintmachinery.com/upload/sanpham/pro9431_front_vprint-6307.png",,,,
Máy in UV phẳng Nocai NC-UV0609PEIII,https://vprintmachinery.com/san-pham/may-in-uv-phang-nocai-ncuv0609peiii-179.html, NC-UV0609PEIII,Giá: Liên hệ,"Model: NC-UV0609PEIII Độ cao in: 130mm Có thể in cùng lúc mực màu, mực trắng và phủ bóng trong một lần in.",,,"{""Model"": ""NC-UV0609PEIII"", ""Đầu in"": ""3 đầu Epson có thể in cùng lúc mực màu, trắng, varnish trong một lần in"", ""kích thước vùng in"": ""tối đa 60*90cm"", ""Vật liệu in"": ""vật liệu phẳng như: nhựa, đá, gỗ, kim loại, thủy tinh..."", ""Độ cao vật liệu in"": ""tối đa 13cm"", ""Mực in"": ""KCMYLcLm+W+V"", ""Độ phân giải"": ""360dpi*720dpi*1440dpi"", ""Phần mềm RIP"": ""Photoprint"", ""Kích thước máy in"": ""155cm*168cm*62cm"", ""Trọng lượng máy in"": ""155kg"", ""Chế độ in"": ""in màu, trắng và màu, phủ bóng"", ""kết nối với máy tính"": ""Ethernet"", ""Hệ điều hành"": ""Win 7(32-64bit), Win 8,8.1 (32-64bit), Win 10 (32-64bit)"", ""nguồn hoạt động"": ""AC220/110v 50-60HZ""}","https://vprintmachinery.com/upload/hinhthem/1-3373.jpg, https://vprintmachinery.com/upload/hinhthem/3-1938.jpg, https://vprintmachinery.com/upload/sanpham/2-8547.jpg",,,,
Máy in phun dữ liệu biến đổi tờ rời,https://vprintmachinery.com/san-pham/May-in-phun-du-lieu-bien-doi-to-roi-335.html,,Giá: Liên hệ,"Máy được sử dụng để in dữ liệu biến đổi liên tục như mã một chiều barcode, mã hai chiều QR code, chữ và hình ảnh trên tờ, dành cho ngành công nghiệp giám sát tín hiệu biến đổi --bao bì dược phẩm, bao bì thực phẩm và các ngành công nghiệp khác như xổ số, vé vào cửa, hóa đơn và thẻ","Máy in phun và kiểm tra lỗi dạng tờ rời dành cho mục đích in số nhảy, in date, đánh dấu lỗi. Máy được ứng dụng trong ngành bao b ì dược, thuốc lá sổ xố, các loại vé, voucher, chứng từ, phiếu bầu cử, ...","1. Hệ thống nạp giấy tự động: Sử dụng đầu bò tương tự như máy offset, tốc độ cao và ổn định 2. Hệ thống phát hiện đúp tờ: Được trang bị cảm biến siêu âm và không phải điều chỉnh thủ công khi thay đổi loại giấy 3. Bù trừ độ lạch hai bên: Tự động điều chỉnh vùng in khi giấy bị lệch 4. Hệ thống hút chân không giữ giấy: Sử dụng băng tải kết hợp hút chân không để đảm bảo cho giấy được ổn định trong quá trình in và kiểm tra chất lượng 5. Hệ thống in phun mực UV/mực nước công nghiệp cho dữ liệu biến đổi 6. Hệ thống kiểm tra dữ liệu in, kiểm tra chất lượng màu sắc và nội dung khác 7. Tất cả các thông số của motor và thông số máy đều có thể tinh chỉnh dễ dàng trên màn hình cảm ứng của máy","{""VPM-IJ-620"": {""Khổ giấy lớn nhất"": ""620x780mm"", ""Khổ giấy nhỏ nhất"": ""297x210mm"", ""Tốc độ cơ học"": ""60-100m/phút"", ""Độ cao chồng giấy"": ""600mm"", ""Tông công suất"": ""8KW"", ""Định lượng giấy cho phép"": ""60-450g/m ²"", ""Khối lượng"": ""1500kg"", ""Không gian máy"": ""6010x1265x1395""}, ""VPM-IJ-780"": {""Khổ giấy lớn nhất"": ""780x780mm"", ""Khổ giấy nhỏ nhất"": ""320x320mm"", ""Tốc độ cơ học"": ""60-120m/phút"", ""Độ cao chồng giấy"": ""600mm"", ""Tông công suất"": ""8KW"", ""Định lượng giấy cho phép"": ""80-450g/m ²"", ""Khối lượng"": ""1700kg"", ""Không gian máy"": ""7150×1420×1400""}, ""VPM-IJ- 1040"": {""Khổ giấy lớn nhất"": ""1040x1040mm"", ""Khổ giấy nhỏ nhất"": ""400x360mm"", ""Tốc độ cơ học"": ""90-150m/phút"", ""Độ cao chồng giấy"": ""600mm"", ""Tông công suất"": ""12KW"", ""Định lượng giấy cho phép"": ""80-600g/m ²"", ""Khối lượng"": ""6800kg"", ""Không gian máy"": ""12000x2850x2350""}}","https://vprintmachinery.com/upload/hinhthem/mayinsonhay2-1629.png, https://vprintmachinery.com/upload/sanpham/Picture1-1129.jpg",,,,
Máy làm ly giấy tốc độ cao 100A / 100B,https://vprintmachinery.com/san-pham/May-lam-ly-giay-toc-do-cao-100A-100B-242.html, 100A / 100B,Giá: Liên hệ,"Máy làm ly giấy tự động tốc độ cao, sản xuất ly giấy thể tích 6-12oz, tốc độ 60-100 cái/phút.","Máy làm ly giấy RD-12/22 là dòng máy làm ly giấy tốc độ cao. Toàn bộ máy sử dụng hệ thống bôi trơn tự động, giúp tất cả các bộ phận cơ khí hoạt động trơn tru hơn. Bộ phận gia nhiệt hàn hông, và hàn đáy bằng khí nóng Leister của Thụy Sĩ giúp đảm bảo độ ổn định của các mối hàn. Bộ phận vê miệng hai bước, uốn mép và gia nhiệt định hình, giúp cho việc vê miệng ổn định hơn và hình thức đẹp hơn. Máy làm ly giấy RD-12/22 đi kèm với hệ thống điều khiển PLC, phát hiện lỗi cảm biến và có thể tự động ngừng hoạt động nếu máy gặp bất kỳ sự cố nào, nó có thể cải thiện đáng kể độ an toàn khi vận hành và giảm chi phí lao động. Máy có thể hoàn thành toàn bộ quy trình một cách tự động bao gồm cấp giấy, dán hông, bế & cấp giấy làm đáy ly, làm nóng, cán vân đáy, vê miệng ly, xếp chồng ly. Đây là sự lựa chọn tốt nhất trong lĩnh vực sản xuất ly cốc giấy. Máy làm ly giấy 100A Máy làm ly giấy 100B",QUY TRÌNH SẢN XUẤT: Quy trình sản xuất ly giấy KÍCH THƯỚC SẢN PHẨM: Kích thước sản phẩm máy 100A Kích thước sản phẩm máy 100B,"{""100A"": {""Thông số ly (cốc)："": ""6-16oz 16-22oz"", ""Vật liệu làm ly："": ""Single PE/Double PE coated paper"", ""Định lượng giấy："": ""210-380g/㎡"", ""Tốc độ："": ""40-100pcs/min"", ""Nguồn điện ："": ""380V/220V 50Hz"", ""Công suất tổng ："": ""10Kw"", ""Nguồn hơi："": ""0.4m3/min"", ""Khối lượng máy："": ""3000Kg"", ""Kích thước："": ""2300*1200*1800mm""}, ""100B"": {""Thông số ly (cốc)："": ""6-32 OZ"", ""Vật liệu làm ly："": ""Single PE/Double PE coated paper"", ""Định lượng giấy："": ""190-500g/㎡"", ""Tốc độ："": ""40-100pcs/min"", ""Nguồn điện ："": ""380V 50Hz"", ""Công suất tổng ："": ""10Kw"", ""Nguồn hơi："": ""0.4m3/min"", ""Khối lượng máy："": ""3500Kg"", ""Kích thước："": ""2750*1660*1900mm(L*W*H)""}}","https://vprintmachinery.com/upload/hinhthem/4102299248800600-932.jpg, https://vprintmachinery.com/upload/hinhthem/427799016800600-4563.jpg, https://vprintmachinery.com/upload/sanpham/RD-1222-100A-4355.png",,,,
Máy bế nhãn KTS công nghiệp 6 dao Ares-350B,https://vprintmachinery.com/san-pham/May-be-nhan-KTS-cong-nghiep-6-dao-Ares350B-283.html, Ares-350B,Giá: Liên hệ,"Máy bế nhãn kỹ thuật số công nghiệp 6 dao. Không cần khuôn, chất lượng Châu Âu.","Máy bế kỹ thuật số công nghiệp với 1 đầu bế gồm 3 dao bế, tốc độ bế cao. Không cần khuôn, giảm chi phí, thời gian, nhân công. Thay đổi bài nhanh chóng, phù hợp với các đơn hàng ngắn, thay đổi hình dạng nhiều. Máy bế nhãn kỹ thuật số công nghiệp Ares-350B","Với 2 đơn vị bế gồm 6 dao bế, cho tốc độ bế cao hơn gấp nhiều lần Được trang bị hệ thống Reborn và servo Panasonic động cơ, ổn định và chính xác cao. Độ dày vật liệu nhãn tối đa 0,35mm, không giới hạn với lớp đế. Giải pháp tuyệt vời cho chạy đơn hàng ngắn và trung bình. Mọi hình dạng và mọi vật liệu đều phù hợp. Cắt những gì bạn muốn bất cứ lúc nào. Linh hoạt để đáp ứng nhanh chóng với những thay đổi của thị trường. Ít hao phí, tiết kiệm chi phí vật liệu và năng lượng. Chẩn đoán từ xa, giảm thiểu sự cố. Ares-350B được trang bị 2 đơn vị bế với 6 đầu dao cho tốc độ bế cao hơn nhiều lần BỘ PHẬN DẪN CUỘN BỘ PHẬN XẢ CUỘN Trục cán màng nguội 2 ĐƠN VỊ BẾ VÀ ĐẦU BẾ BỘ PHẬN THU CUỘN VÀ LỘT MATRIX CÁC BỘ PHẬN KHÁC Bộ phận cắt tờ Hệ thống điện Tùy chọn chia cuộn 6 dao TỐC ĐỘ BẾ THAM KHẢO Hình dạng nhãn Kích thước nhãn (mm) Độ dài lặp lại (mm) Tốc độ (m/phút) (Một đơn vị bế 3 dao) Thời gian bế 200 x 150 406 18.45 4 dao 4 nhãn trong 1.32 giây 100 x 40 206 7.73 6 dao 12 nhãn trong 1.6 giây 100 x 40 206 2.46 2 dao 14 nhãn trong 5.02 giây 180 x 100 366 18.07 6 dao 6 nhãn trong 1.22 giây 50 204 9.2 4 dao 1 nhãn trong 1.33 giây 150 304 28.27 2 dao 2 nhãn trong 0.64 giây","{""Khổ cuộn tối đa"": ""350mm"", ""Chiều dài lặp lại tối đa"": ""980mm"", ""Khoảng cách tối thiểu giữa 3 dao/KC tối đa giữa 2 dao/KC tối đa giữa 3 dao"": ""65mm/160mm/105mm"", ""Đường kính tối đa xả/thu cuộn"": ""650mm""}","https://vprintmachinery.com/upload/hinhthem/RBJ350B-drawing-4610.jpg, https://vprintmachinery.com/upload/sanpham/RBJ-350B-Two-unit-6-blades-roll-fed-digicut-system-introduction-5585.jpg",,,,
Máy Cắt Giấy Thủy Lực,https://vprintmachinery.com/san-pham/May-Cat-Giay-Thuy-Luc-166.html, VP-H520/VP-H720,Giá: Liên hệ,"- Hỗ trợ nhiều chương trình cắt được lập trình, thao tác với màn hình LCD và nút bấm. - Đường cắt được định vị trước bằng ""đường quang màu đỏ"" giúp thao tác hoàn toàn chính xác. - Tự động kẹp giấy - Bàn mạ crom bóng, bi gió - Cảm biến hồng ngoại an toàn vận hành trên bàn máy","Dòng máy cắt thủy lực lập trình ""hạng nặng"" đáp ứng nhu cầu về số lượng lớn, khổ giấy lớn và tốc độ lớn, phù hợp với các cơ sở in, xưởng sản xuất... - Hỗ trợ nhiều chương trình cắt được lập trình, thao tác với màn hình LCD và nút bấm. - Đường cắt được định vị trước bằng ""đường quang màu đỏ"" giúp thao tác hoàn toàn chính xác. - Tự động kẹp giấy - Bàn mạ crom bóng, bi gió - Cảm biến hồng ngoại an toàn vận hành trên bàn máy - Điều chỉnh cữ bằng lập trình - Tự động đẩy giấy đã cắt xong ra ngoài. - Nút start và nút dừng khẩn cấp. - Độ chính xác : ±0.2mm",,"{""VP-H520"": {""Chiều rộng giấy"": ""520mm"", ""Chiều dài giấy"": ""520mm"", ""Độ dày giấy"": ""75mm"", ""Trọng lượng máy"": ""480Kg"", ""Nguồn máy"": ""220V, 50Hz, 2KW""}, ""VP-H670"": {""Chiều rộng giấy"": ""670mm"", ""Chiều dài giấy"": ""670mm"", ""Độ dày giấy"": ""90mm"", ""Trọng lượng máy"": ""630Kg"", ""Nguồn máy"": ""220V, 50Hz, 2,2KW""}}","https://vprintmachinery.com/upload/hinhthem/maycatgiaythuyluc5202-2339.jpg, https://vprintmachinery.com/upload/hinhthem/maycatgiaythuyluc5203-8523.jpg, https://vprintmachinery.com/upload/sanpham/may-cat-thuy-luc-520-2922.jpg",,,,
YD-F2513R5-40_Máy in UV dạng bàn,https://vprintmachinery.com/san-pham/YDF2513R540May-in-UV-dang-ban-24.html, YD-F2513R5-40,Giá: Liên hệ,"Máy in UV chất lượng cao khổ máy 2500x1300mm, chiều cao vật in lên đến 400mm đầu in công nghiệp Ricoh G5 công nghiệp, máy có độ bền, độ phân giải và tốc độ cao nhất thị trường.","Máy in UV hiệu YOTTA| Máy in trên mọi chất liệu và bề mặt cho quảng cáo và trang trí nội thất VPrint xin giới thiệu dòng máy in UV dạng tấm flatbed hiệu Yotta. Máy được trang bị đầu in Ricoh công nghiệp thế hệ 5, có hệ thống gia nhiệt, hạt mực phun thay đổi từ 7pl đến 35pl nên dễ dàng đạt độ phân giải cao nhất trên thị trường 600x2400dpi, đầu in bằng thép không rỉ có khả năng chống mài mòn cao nên có tuổi thọ lớn có thể lên đến 5 năm. Dòng máy in này với hệ cơ khí được chế tạo ở cấp chính xác cao lên đến mimicromet và được trang bị động cho secvo của Panasonic bền và chính xác nên cho hình ảnh in cực kỳ sắc nét và chính xác. Máy in dùng để in hộp rựu, vali, Alu, tủ nhựa, tấm trần, mica, thạch cao, các loại bạt, tranh gạch , tranh kính, tranh canvas 3D/5D ... Máy in UV YD-F2513R5-40 dạng phẳng flatbed","Tại sao nên chọn máy in UV dạng tấm hiệu Yotta? - Đầu in công nghiệp thế hệ 5 của Ricoh bằng thép không rỉ cho tuổi thọ cao -Độ phân giải (600x2400 dpi) và tốc độ thực tế cao nhất thị trường - Đèn UV LED sản xuất tại Mỹ có hiệu suất cao và tuổi thọ bền (lên đến 30.000 giờ sử dụng) hơn loại đèn UV thủy ngân thông thường - Nhiều màu- từ 4 đến 7 màu c - Máy in đạt chứng chỉ CE, RoHS và sở hữu nhiều bằng sáng chế - Hệ thống tự động chống va chạm để bảo vệ đầu in - Tự động định vị trí và chiều cao vật liệu cần in - Máy được trang bị bàn hút chân không để giữ ổn định vật liệu mỏng, bản hút chân không được chi thành từng vùng để tối ưu việc sử dụng - Hệ thống áp suất âm giúp hình ảnh in sống động hơn đồng thời tiết kiệm mực in và bảo vệ đầu in - Tự động định vị trí và chiều cao vật liệu cần in cho phép in lên đến cao đến 100 mm và 450mm - Máy có độ chính xác cao lên đến 1micromet cho phần cơ khí - Động cơ servo của Panasonic cho phép điều khiển chính xác các chuyển động - Hệ thống đường ray đôi Hiwin của Đài Loan giúp tăng độ ổn định và giảm độ ồn - Máy được thiết kế để có thể hoạt động 24/7","{""Model"": ""YD-F2513R5-40"", ""Khích thước vùng in"": ""2500x1300mm"", ""Số đầu in"": ""từ 4-8 cái (cho 4 đến 8 màu)"", ""Chế độ in"": ""Một chiều/hai chiều"", ""Đầu in/Công nghệ in"": ""Ricoh Gen5/ Grey level Piezo"", ""Mực"": ""Lm, Lc, Y,M,C,K (tùy chọn)/Mục UV thân thiện môi trường (No VOC)"", ""Mực đặc biệt"": ""Mực UV trắng hoặc mực UV vecni"", ""Độ phân giải"": ""600x2400dpi"", ""Phần mềm"": ""PhotoPrint"", ""File format"": ""Adobe Postcript level3, PDF, JPEG, TIFF, EPS, AI"", ""Chiều dầy vật liệu"": ""400mm"", ""Vật liệu có thể in"": ""đá, gỗ, vải, kim loại, thủy tinh... cứng và mềm"", ""Nguồn yêu cầu"": ""AC 220V, 50/60Hz, 6KW"", ""Kích thước máy (LxWxH), khối lượng"": ""4450x2115x1310mm, 1300Kg""}",https://vprintmachinery.com/upload/sanpham/may-in-uv-phang-yd-f2513r5-40-7492.JPG,,,,
SunPack WK02-30B-60,https://vprintmachinery.com/san-pham/SunPack-WK0230B60-160.html, WK02-30B-60,Giá: Liên hệ,"Máy bó dây băng khổ lớn, dễ thao tác, dễ di chuyển với khung sườn gắn bánh xe, tiết kiệm chi phí và nhân lực cho việc đóng gói","Dòng máy bó dây băng Sunpack W02-30B-60 là giải pháp hàng đầu cho việc đóng bó các sản phẩm khổ lớn. Tối ưu và tiết kiệm cả nhân công, thời gian và chi phí cho công đoạn đóng gói.","- Với bộ khung lớn khổ 600 x 600mm đáp ứng được đa dạng kích thước về việc đóng gói hàng hóa - Tốc độ cao: không quá 3s/lần - Có thêm bộ chân cấp có thể gắn cuộn lên đến 500m tiết kiệm hơn thời gian và chi phí - Sử dụng được cả dây bó loại màng hoặc giấy tùy theo mục dích sử dụng - Dễ thao tác, tiết kiệm thời gian và chi phí cho việc đóng gói - Máy có bánh xe dễ di chuyển và không gò bó vị trí, không gian cần đóng gói","{""Chất liệu cuộn"": ""Giấy (100-120Mu) x L 500mm/ Màng Opp"", ""Thông số kỹ thuật cuộn băng"": ""W 29.2 – 29.4mm"", ""Thời gian bó"": ""< 3s"", ""Áp lực"": ""5-40N"", ""Khổ đóng bó"": ""Max: 600 x 600mm; Min: 30 x 10mm"", ""Nguồn điện sử dụng"": ""220V 50Hz/60Hz; 110V 60Hz"", ""Công suất"": ""120W"", ""Trọng lượng"": ""85kg""}",https://vprintmachinery.com/upload/sanpham/wk02-30b-60-01-4758.PNG,,,,
