name,product_url,sku,price,summary,description,features,specs_json,image_urls,source_url,category_id,view_count,unused
Máy bế - dập nổi nóng - gỡ phoi tự động Jiguo MYRP-1060High,https://vprintmachinery.com/san-pham/May-be-dap-noi-nong-go-phoi-tu-dong-Jiguo-MYRP1060High-187.html, MYRP-1060High,Giá: Liên hệ,"Máy bế - dập nổi nóng - gỡ phoi tự động Jiguo MYRP-1060High tích hợp nhiều tính năng trong một thiết bị, mang lại sự tiện dụng và năng suất cao.",Máy bế - dập nổi nóng - gỡ phoi tự động Jiguo MYRP 1060High,"1. Dẫn hướng phía trước được điều chỉnh bằng động cơ bước, dễ dàng vận hành và đảm bảo độ chính xác cao. 2. Bộ phận truyền tải tấm áp dụng cơ cấu có thể điều chỉnh, đảm bảo tốc độ và độ chính xác, đặc biệt phù hợp với việc truyền tấm mỏng. 3. Áp dụng bộ mã hóa trong chương trình điều khiển, giúp cho việc phối hợp các hoạt động của máy. 4. Xích nhíp có thể được bôi trơn theo thời gian và số lượng. Thời gian nghỉ có thể được thiết lập tự do. 5. Hệ thống lấy mẫu bằng khí nén giúp cho việc kiểm tra mẫu thuận tiện hơn. 6. Tất cả các thiết bị điện, ổ trục, chốt cài, dây xích được nhập khẩu từ các thương hiệu nổi tiếng, đảm bảo độ chính xác và tuổi thọ. 7 Tất cả các đơn vị điện đã có Chứng chỉ CE, mọi biện pháp bảo vệ đều đáp ứng với Tiêu chuẩn CE, an toàn và đáng tin cậy.","{""Khổ giấy lớn nhất (mm)"": ""1070×770"", ""Khổ giấy nhỏ nhất (mm)"": ""380×340"", ""Kích thước cắt lớn nhất (mm)"": ""1040×750"", ""Tốc độ cắt lớn nhất (tờ/giờ)"": ""7000"", ""Độ chính xác (mm)"": ""±0.12"", ""Độ dày giấy (mm)"": ""0.1~4"", ""Áp lực cắt lớn nhất (Tấn)"": ""580"", ""Tổng công suất (kW)"": ""48"", ""Khối lượng tổng (Tấn)"": ""24"", ""Kích thước máy (mm)"": ""8350 × 4080 × 2280"", ""Cạnh nhíp gắp nhỏ nhất (mm)"": ""8"", ""Chiều cao chồng giấy đầu cấp (mm)"": ""1600"", ""Chiều cao chồng giấy đầu ra (mm)"": ""1400"", ""Tốc độ dập lớn nhất (tờ/giờ)"": ""5500"", ""Nhiệt độ dập (℃)"": ""0~199"", ""Số vùng sấy nhiệt"": ""12""}",https://vprintmachinery.com/upload/sanpham/Jigou-MYRP-1060High-0894.jpg,,,,
Hệ thống kiểm tra giám sát lỗi in tự động của hảng FUTEC,https://vprintmachinery.com/san-pham/he-thong-kiem-tra-giam-sat-loi-in-tu-dong-cua-hang-futec-43.html,,Giá: Liên hệ,Hệ thống kiểm tra giám sát lỗi in tự động của hảng FUTEC Nhật Bản,"Hệ thống kiểm tra giám sát lỗi in tự động của hảng FUTEC Nhật Bản Hệ thống kiểm tra giám sát lỗi in tự động Với những máy in cuộn và in tờ rời cho những sản phẩm chất lượng cao và thời gian giao hàng gắt gao, bạn đã có phương pháp hữu hiệu giúp kiểm soát và báo lỗi in? Hiện chúng tôi có giải pháp bạn cần nhằm giữ uy tín với khác hàng bằng những sản phẩm chất lượng, giao hàng đúng hạn nhờ vào hệ thống giám sát và báo lỗi in đến từ Công ty FUTEC, Nhật Bản với trên 35 năm kinh nghiệm trong việc kiểm soát các lỗi in. Các hệ thống thông minh này có thể báo tới máy tính tại văn phòng và qua các thiết bị di động như điện thoại...đồng thời chúng sẽ đánh dấu khu vực bị lỗi giúp bạn có thể loại bỏ phế phẩm một cách nhanh chóng hoặc dừng dây chuyền để điều chỉnh, giúp tiết kiệm nguyên liệu và thời gian. Download catalogue: EasyMaxFX EasyMaxGS EasyMaxGR Max.Eye Basic Max.Eye Impact MaxEye.Color >>Yêu cầu báo giá",,,https://vprintmachinery.com/upload/sanpham/inspection20concept-5759.jpg,,,,
Máy cắt/xả tờ tốc độ cao,https://vprintmachinery.com/san-pham/May-catxa-to-toc-do-cao-274.html, RS145/165/195,Giá: Liên hệ,Máy cắt xả tờ từ giấy cuộn đẳng cấp thể giới. Sử dụng cơ cấu dao đôi (trên dưới) xoay đồng bộ cho tốc độ cao và hoạt động êm ái hơn các dòng máy khác trên thị trường.,"VPRINT MACHINERY - GIẢI PHÁP MỚI CHO NGÀNH IN VÀ BAO BÌ Máy cắt xả tờ từ giấy cuộn đẳng cấp thể giới từ Ấn Độ với nhiều công nghệ hiện đại hỗ trợ quá trình cắt xả tờ từ giấy cuộn. Đặc biệt hệ thống dao xoay đôi (trên - dưới) đồng bộ thay thế cho công nghệ dao đơn và thớt cho tốc độ cắt cao hơn và chất lượng sản phẩm cao hơn đồng thời hoạt động êm ái hơn, độ rung và tiếng ồn thấp. Sự lựa chọn lí tưởng và xứng đáng cho các cho các nhà máy sản xuất/thành phẩm giấy, nhà buôn giấy, các nhà in offset có sản lượng lớn... Máy cắt xả tờ RS145/165/195",Đặt kích thước cắt bằng kỹ thuật số Thiết lập và chuyển đổi kích thước cắt một cách nhanh chóng Hiệu quả về chi phí với độ chính xác cao Dễ dàng vận hành và bảo trì CÁC TÍNH NĂNG 1. Bộ phận nâng xả cuộn Cấu trúc hạng nặng với bộ trợ lực thủy lực để nâng cuộn Các cánh tay nằm trên thanh dẫn LM chuyển động theo trục với sự trợ giúp của các động cơ giảm tốc Hệ thống kiểm soát lực căng hai bên bằng điện-khí nén Hệ thống theo dõi và xe đẩy bằng tay để di chuyển cuộn giấy 2. Đơn vị chống cong quăn giấy Đơn vị chống cong giấy tự động cho giấy và bìa Đơn vị được vận hành thông qua động cơ giảm tốc Được trang bị thanh chống tĩnh điện cho mỗi đường giấy 3. Đơn vị chia cuộn Dao chia cuộn trên và dưới vận hành bằng khí nén Dễ dàng điều chỉnh bằng tay các dao chia cuộn thông qua cơ cấu thanh răng và bánh răng 4. Hệ thống xả giấy đồng bộ kỹ thuật số Hệ thống cắt xả ngang bằng dao xoay trên-dưới đồng bộ công suất lớn điều khiển bằng servo Chiều dài tờ giấy yêu cầu được thực hiện dễ dàng bằng cách nhập đầu vào vào HMI Cung cấp không gian vận hành để dễ dàng thay dao và bảo trì 5. Hệ thống vận chuyển giấy Cảm biến kẹt giấy tự động dừng máy Cổng thải loại để loại bỏ các tờ giấy được điều khiển bằng tay bởi người vận hành Bộ phận hút chân không tự động dựa trên Servo để chồng các tờ đúng cách để đi qua trơn tru 6. Bộ phần đầu ra Hệ thống thổi hơi được cung cấp để xếp chồng tốt hơn Hệ thống vỗ giấy 3 mặt bằng máy rung khí nén để vỗ giấy tốt hơn 7. Bảng điều khiển Bảng điều khiển điện tử công nghệ cao cho phép để vận hành tất cả các chức năng điện và điện tử,"{""Apex RS145"": {""Tốc độ* (m/phút)"": ""300"", ""Chiều rộng cuộn (mm)"": ""400 - 1500"", ""Đường kính cuộn (mm)"": ""500 - 1600"", ""Trọng lượng cuộn tối đa (Kgs.)"": ""3000"", ""Đường kính lõi cuộn (mm)"": ""152.4"", ""Chiều rộng tờ cắt (mm)"": ""350 - 1450"", ""Chiều dài tờ cắt (mm)"": ""450 - 1650"", ""- Độ chính xác chiều dài (mm)"": ""±0.5 < 1000"", ""cho Một/Nhiều đường giấy"": ""±0.05% > 1000"", ""- Độ vuông (%) của chiều rộng tờ"": ""0.06%"", ""Định lượng xả tờ max (GSM)"": ""1000"", ""Định lượng chia cuộn max (GSM)"": ""600"", ""Chiều cao chồng giấy max (Incl. Pallet) (mm)"": ""1500"", ""Khối lượng chồng giấy max (Kgs.)"": ""2500"", ""Lề giấy tối đa (mm)"": ""50"", ""Vật liệu"": ""Giấy và bìa""}, ""Apex RS165"": {""Tốc độ* (m/phút)"": ""300"", ""Chiều rộng cuộn (mm)"": ""400 - 1700"", ""Đường kính cuộn (mm)"": ""500 - 1600"", ""Trọng lượng cuộn tối đa (Kgs.)"": ""3400"", ""Đường kính lõi cuộn (mm)"": ""152.4"", ""Chiều rộng tờ cắt (mm)"": ""350 - 1650"", ""Chiều dài tờ cắt (mm)"": ""450 - 1650"", ""- Độ chính xác chiều dài (mm)"": ""±0.5 < 1000"", ""cho Một/Nhiều đường giấy"": ""±0.05% > 1000"", ""- Độ vuông (%) của chiều rộng tờ"": ""0.06%"", ""Định lượng xả tờ max (GSM)"": ""1000"", ""Định lượng chia cuộn max (GSM)"": ""600"", ""Chiều cao chồng giấy max (Incl. Pallet) (mm)"": ""1500"", ""Khối lượng chồng giấy max (Kgs.)"": ""2800"", ""Lề giấy tối đa (mm)"": ""50"", ""Vật liệu"": ""Giấy và bìa""}, ""Apex RS195"": {""Tốc độ* (m/phút)"": ""300"", ""Chiều rộng cuộn (mm)"": ""400 - 2000"", ""Đường kính cuộn (mm)"": ""500 - 1600"", ""Trọng lượng cuộn tối đa (Kgs.)"": ""4000"", ""Đường kính lõi cuộn (mm)"": ""152.4"", ""Chiều rộng tờ cắt (mm)"": ""350 - 1950"", ""Chiều dài tờ cắt (mm)"": ""450 - 1650"", ""- Độ chính xác chiều dài (mm)"": ""±0.5 < 1000"", ""cho Một/Nhiều đường giấy"": ""±0.05% > 1000"", ""- Độ vuông (%) của chiều rộng tờ"": ""0.06%"", ""Định lượng xả tờ max (GSM)"": ""1000"", ""Định lượng chia cuộn max (GSM)"": ""600"", ""Chiều cao chồng giấy max (Incl. Pallet) (mm)"": ""1500"", ""Khối lượng chồng giấy max (Kgs.)"": ""3400"", ""Lề giấy tối đa (mm)"": ""50"", ""Vật liệu"": ""Giấy và bìa""}}",https://vprintmachinery.com/upload/sanpham/Aura_RS_61-1514.png,,,,
Máy Làm Vở Bài Tập Tự Động Hoàn Toàn Nova RB120™ / Nova RB104 LC™ / Nova RB104™,https://vprintmachinery.com/san-pham/May-Lam-Vo-Bai-Tap-Tu-Dong-Hoan-Toan-Nova-RB120-Nova-RB104-LC-Nova-RB104-350.html,,Giá: Liên hệ,"Máy làm vở bài tập tự động hoàn toàn Nova RB120™, Nova RB104 LC™ và Nova RB104™ là những sản phẩm tiên tiến, phù hợp cho các doanh nghiệp có sản lượng vừa phải và yêu cầu chất lượng cao. Với mức độ tự động hóa cao, các máy này sẽ giúp tối ưu hóa quy trình sản xuất của bạn.",Máy làm vở tự động hoàn toàn được trang bị các linh kiện tiên tiến sau: Giá cuốn giấy không trục : Giúp giữ cố định cuộn giấy trong quá trình sản xuất. Tháp in hai màu : Cho phép in ấn hiệu quả với chất lượng màu sắc tối ưu. Bộ phận cắt ngang : Cắt giấy chính xác theo chiều ngang. Bộ phận xếp chồng giấy : Tổ chức và xếp giấy thành từng chồng gọn gàng. Bộ phận đếm và sắp xếp giấy : Đếm số tờ và sắp xếp chúng theo thứ tự. Bộ phận chèn tờ mục lục in sẵn : Chèn mục lục vào sách một cách tự động. Bộ phận chèn bìa tiêu đề in sẵn : Gắn bìa của sách để hoàn thiện hình thức sản phẩm. Bộ phận khâu chỉ : Khâu các tờ với nhau để giữ chặt. Bộ phận gấp : Gấp các tờ giấy theo yêu cầu. Bộ phận ép gáy vuông cơ học : Ép gáy sách để tạo ra hình dáng vuông hoàn hảo. Bộ phận cắt bìa trước : Cắt bìa sách theo kích thước chuẩn. Bộ phận cắt tách sách : Tách các cuốn sách ra khỏi nhau. Bàn đưa sách ra : Giúp chuyển sách ra ngoài sau khi hoàn thiện. Quạt hút loại bỏ phế phẩm : Hút và loại bỏ các phế phẩm trong quá trình sản xuất. Hệ thống bôi trơn : Đảm bảo máy hoạt động trơn tru và hiệu quả. Bảng điều khiển trung tâm (PLC) : Quản lý và điều khiển toàn bộ quy trình sản xuất.,Sản lượng ổn định : Máy đảm bảo hiệu suất cao với chất lượng đầu ra tuyệt vời. Tuổi thọ lâu hơn : Thiết kế chất lượng cao nhằm gia tăng độ bền. Dễ dàng vận hành : Giao diện thân thiện và chi phí bảo trì thấp.,"{""Nova RB104™"": {""Tốc độ cuộn* (mét/phút)"": ""300"", ""Chuyển đổi nhịp* (chu kỳ/phút)"": ""50"", ""Số lần lên (tối đa)"": ""5"", ""Chiều rộng cuộn (mm)"": ""400 - 1040"", ""Chiều rộng in (mm)"": ""400 - 1030"", ""Đường kính cuộn dây (mm)"": ""1400"", ""Đường kính lõi (mm)"": ""76,2"", ""Trọng lượng cuộn dây (kg)"": ""1500"", ""Tháp in"": ""2 bộ phận in flexo màu ở mỗi bên"", ""Chiều dài in và cắt (mm)"": ""Từ 290 đến 450 (sai số 5 mm)"", ""Số tờ"": ""4 - 50 tờ"", ""Giấy (GSM)"": ""45 - 70"", ""Mục lục & Tiêu đề (GSM)"": ""50 - 600"", ""Độ dày đường khâu tối đa (mm)"": ""5"", ""Diện tích sàn (Dài x Rộng x Cao) (mét)"": ""26 x 10 x 4""}, ""Nova RB104 LC™"": {""Tốc độ cuộn* (mét/phút)"": ""300"", ""Chuyển đổi nhịp* (chu kỳ/phút)"": ""50"", ""Số lần lên (tối đa)"": ""5"", ""Chiều rộng cuộn (mm)"": ""400 - 1040"", ""Chiều rộng in (mm)"": ""400 - 1030"", ""Đường kính cuộn dây (mm)"": ""1400"", ""Đường kính lõi (mm)"": ""76,2"", ""Trọng lượng cuộn dây (kg)"": ""1500"", ""Tháp in"": ""2 bộ phận in flexo màu ở mỗi bên"", ""Chiều dài in và cắt (mm)"": ""Từ 290 đến 700 (sai số 5 mm)"", ""Số tờ"": ""4 - 50 tờ"", ""Giấy (GSM)"": ""45 - 70"", ""Mục lục & Tiêu đề (GSM)"": ""50 - 600"", ""Độ dày đường khâu tối đa (mm)"": ""5"", ""Diện tích sàn (Dài x Rộng x Cao) (mét)"": ""30 x 10 x 4""}, ""Nova RB120™"": {""Tốc độ cuộn* (mét/phút)"": ""300"", ""Chuyển đổi nhịp* (chu kỳ/phút)"": ""50"", ""Số lần lên (tối đa)"": ""6"", ""Chiều rộng cuộn (mm)"": ""600 - 1200"", ""Chiều rộng in (mm)"": ""600 - 1190"", ""Đường kính cuộn dây (mm)"": ""1400"", ""Đường kính lõi (mm)"": ""76,2"", ""Trọng lượng cuộn dây (kg)"": ""1700"", ""Tháp in"": ""2 bộ phận in flexo màu ở mỗi bên"", ""Chiều dài in và cắt (mm)"": ""Từ 290 đến 450 (sai số 5 mm)"", ""Số tờ"": ""4 - 50 tờ"", ""Giấy (GSM)"": ""45 - 70"", ""Mục lục & Tiêu đề (GSM)"": ""50 - 600"", ""Độ dày đường khâu tối đa (mm)"": ""5"", ""Diện tích sàn (Dài x Rộng x Cao) (mét)"": ""26 x 10 x 4""}}",https://vprintmachinery.com/upload/sanpham/Nova-RP-small-9932.png,,,,
Phần mềm ERP cho Bao bì mềm | Giải pháp quản lý sản xuất bao bì thông minh,https://vprintmachinery.com/san-pham/Phan-mem-ERP-cho-Bao-bi-mem-Giai-phap-quan-ly-san-xuat-bao-bi-thong-minh-344.html,,Giá: Liên hệ,"Khám phá phần mềm ERP chuyên biệt cho ngành bao bì mềm giúp tối ưu sản xuất, quản lý nguyên liệu, đảm bảo truy xuất nguồn gốc và nâng cao lợi nhuận.","1. Thách thức trong ngành bao bì mềm hiện nay Ngành bao bì mềm (flexible packaging) đang phát triển mạnh mẽ nhờ nhu cầu đóng gói thực phẩm, dược phẩm, FMCG. Tuy nhiên, doanh nghiệp đang đối mặt với nhiều thách thức: Quản lý nguyên vật liệu đa dạng như màng nhựa, film, mực in đặc thù. Đơn hàng nhiều mẫu mã, kích thước phức tạp . Yêu cầu truy xuất nguồn gốc & an toàn thực phẩm ngày càng khắt khe. Áp lực giảm chi phí, tăng tốc độ giao hàng trong khi vẫn phải đảm bảo chất lượng cao. Để vượt qua, ERP chuyên ngành bao bì mềm chính là giải pháp chiến lược. 2. ERP cho bao bì mềm là gì? ERP (Enterprise Resource Planning) cho bao bì mềm là hệ thống quản lý tổng thể, tích hợp toàn bộ hoạt động sản xuất và kinh doanh của doanh nghiệp bao bì. Các chức năng nổi bật: Quản lý nguyên vật liệu đặc thù (film, màng nhựa, hạt nhựa, mực in). Theo dõi quá trình sản xuất : in ống đồng, in flexo, ghép màng, cắt dán. Lập kế hoạch sản xuất tối ưu , giảm thời gian chết máy. Quản lý đơn hàng phức tạp theo từng khách hàng, kích thước, mẫu mã. Đảm bảo truy xuất nguồn gốc – đáp ứng tiêu chuẩn an toàn thực phẩm & dược phẩm. Báo cáo chi phí – lợi nhuận chi tiết theo từng đơn hàng hoặc dây chuyền. 3. Lợi ích khi ứng dụng ERP trong quản lý bao bì mềm Giải pháp ePS ERP đem đến những giá trị vượt trội: Tăng năng suất : Tích hợp dữ liệu từ đơn hàng → sản xuất → giao hàng. Giảm chi phí & lãng phí : Kiểm soát nguyên liệu chặt chẽ, giảm tồn kho dư thừa. Đáp ứng nhanh thị trường : Lập lịch sản xuất thông minh, rút ngắn thời gian giao hàng. Tuân thủ tiêu chuẩn quốc tế : Đáp ứng quy định về an toàn, truy xuất nguồn gốc. Ra quyết định chính xác : Báo cáo real-time, hỗ trợ lãnh đạo điều hành hiệu quả. 4. Vì sao chọn ERP ePS cho ngành bao bì mềm? Theo ePS – chuyên gia toàn cầu trong phần mềm quản lý bao bì: Chuyên biệt cho bao bì mềm → Không cần tùy chỉnh phức tạp. Đa site, đa ngôn ngữ, đa tiền tệ → Hỗ trợ doanh nghiệp mở rộng quốc tế. Hạ tầng cloud-ready, bảo mật cao → Truy cập từ xa, an toàn, ổn định. Được tin dùng bởi các nhà sản xuất bao bì hàng đầu thế giới → minh chứng hiệu quả thực tế. 5. Kết luận – ERP là chìa khóa cho tương lai bao bì mềm Trong kỷ nguyên Công nghiệp 4.0 , ERP chính là nền tảng số hóa giúp doanh nghiệp bao bì mềm: ✅ Quản lý sản xuất tinh gọn – ✅ Tối ưu chi phí – ✅ Đảm bảo chất lượng & tuân thủ. Với ERP ePS , bạn không chỉ nâng cao hiệu quả sản xuất mà còn xây dựng nền tảng cho nhà máy bao bì thông minh trong tương lai.","Vprint Machinery tự hào là đối tác triển khai giải pháp tại Việt Nam của eProductivity Software (ePS) – tập đoàn công nghệ phần mềm hàng đầu thế giới chuyên cung cấp các giải pháp quản lý sản xuất cho ngành bao bì và in ấn. Về ePS Packaging - Là đơn vị trực thuộc ePS – tập đoàn phần mềm có trụ sở tại Mỹ, với mạng lưới hoạt động toàn cầu. - Hơn 30 năm kinh nghiệm trong việc phát triển các giải pháp ERP & MES chuyên biệt cho ngành bao bì: bao bì giấy, nhựa, carton, nhãn, in ấn công nghiệp,... - Giải pháp của ePS đã được triển khai thành công tại hơn 10.000 nhà máy sản xuất tại 40+ quốc gia. - Công nghệ tiên tiến, được cập nhật liên tục theo tiêu chuẩn quốc tế, tối ưu vận hành và lợi nhuận cho nhà máy.",,https://vprintmachinery.com/upload/sanpham/erp-2-9142.png,,,,
Máy làm túi giấy in 2 màu tốc độ cao VPJD-350J-2C,https://vprintmachinery.com/san-pham/May-lam-tui-giay-in-2-mau-toc-do-cao-VPJD350J2C-269.html, VPJD-350G-2C,Giá: Liên hệ,Máy làm túi giấy đáy dẹt tự động tốc độ cao được tích hợp đơn vị in 2 màu.,"Máy làm túi giấy đáy dẹt tốc độ cao hoàn toàn tự động phù hợp với nhiều loại giấy cuộn khác nhau, chẳng hạn như giấy Kraft, giấy bóng, giấy tráng, giấy y tế, v.v. Máy làm túi giấy in 2 màu tốc độ cao VPJD-350J-2C Một số sản phẩm của VPJD-350J-2C","Màn hình cảm ứng YASKAWA Nhật Bản, dễ dàng vận hành và điều khiển. Bộ điều khiển chuyển động YASKAWA ((PC)), tích hợp với sợi quang, đảm bảo máy hoạt động với tốc độ cao ổn định. Động cơ servo YASKAWA được tích hợp với cảm biến quang học chỉnh lưu SICK chính hãng của Đức, đảm bảo chiều dài giấy in được theo dõi một cách chính xác. Việc cấp và tháo cuộn nguyên liệu thông qua cơ cấu nâng tự động thủy lực và điều khiển lực căng hoàn toàn tự động. Hệ thống điều chỉnh cạnh vật liệu SELECTRA của Ý, cắt giảm đáng kể thời gian căn chỉnh cạnh vật liệu.",,https://vprintmachinery.com/upload/sanpham/VG350-2color-0020.jpg,,,,
Máy bế tự động Jiguo MY-1060High,https://vprintmachinery.com/san-pham/May-be-tu-dong-Jiguo-MY1060High-185.html, MY-1060High,Giá: Liên hệ,Máy cấn tự động khổ lớn 1060x760.,,"1. Thông qua bộ điều khiển lập trình, nó được kết hợp với bộ cấp giấy hoàn toàn tự động, cắt bế, ra thành phẩm, cảnh báo báo chướng ngại vật, kiểm tra và đo lường. 2. Sử dụng duy nhất cớ cấu cam gián đoạn được thiết kế bởi máy tính, đảm bảo độ chính xác khi cắt và độ ổn định của thanh kẹp. 3. Động cơ chính được điều khiển bởi biến tần, giúp đạt được sự điều tiết tốc độ vô cấp và vận hành trơn tru. 4. Vòng bi, xích, biến tần và tất cả các loại công tắc điện được nhập khẩu với chất lượng tốt. 5. Nhiều cảm biến và thiết bị an toàn được đặt trên máy để đảm bảo hoạt động bình thường và an toàn cho con người.","{""Khổ giấy lớn nhất (mm)"": ""1060 × 760"", ""Khổ giấy nhỏ nhất (mm)"": ""400 × 360"", ""Kích thước cắt lớn nhất (mm)"": ""1040 × 740"", ""Tốc độ cắt lớn nhất (tờ/giờ)"": ""7500"", ""Độ chính xác (mm)"": ""±0.1"", ""Độ dày giấy (mm)"": ""0.1~4"", ""Áp lực cắt lớn nhất (Tấn)"": ""350"", ""Tổng công suất (kW)"": ""21"", ""Khối lượng tổng (Tấn)"": ""17.8"", ""Kích thước máy (mm)"": ""5120 × 2280 × 2230"", ""Cạnh nhíp gắp nhỏ nhất (mm)"": ""7""}",https://vprintmachinery.com/upload/sanpham/jigou-my-1060high-5535.JPG,,,,
