name,product_url,sku,price,summary,description,features,specs_json,image_urls,source_url,category_id,view_count,unused
Máy dán hộp thùng 4-6 cạnh khổ lớn M 4/6 Series,https://vprintmachinery.com/san-pham/May-dan-hop-thung-46-canh-kho-lon-M-46-Series-259.html, May dan hop ZP-M 4/6 series,Giá: Liên hệ,"Máy dán hộp, thùng carton tự động, dán hộp 4 cạnh 6 cạnh, tốc độ cao.","VPRINT MACHINERY - GIẢI PHÁP MỚI CHO NGÀNH IN VÀ BAO BÌ Dòng máy cao cấp sử dụng phụ tùng cao cấp từ Đức, Nhật Các kiểu hộp và thông số","Bộ phận cấp giấy Bộ phận cấp giấy bằng ma sát. Điều khiển độc lập bằng biến tần. Chức năng điều chỉnh rung xếp chồng giấy Cửa cấp hông điều chỉnh được tối đa theo chiều rộng sản phẩm Bảng điều khiển cảm ứng và nút bấm điều khiển toàn bộ quá trình vận hành Phần xếp chồng mở rộng hỗ trợ gấp hộp dài Vách hông điều chỉnh tự động bằng motor (tự động) Bộ phận định vị hông Bộ phận độc lập định vị theo chiều hông đảm bảo sản phẩm vào bộ phận gấp và dán một cách song song tuyệt đối Điều khiển độc lập bằng motor Có thể định vị theo bất kì phía nào của máy Cài đặt nhanh chóng và dễ dàng Bộ phận gấp hông Tay gấp cánh trái lên đến 180° Gấp đường gấp thứ ba lên đến 135° Bộ phận mở đường cấn thứ nhất và thứ ba Bộ phận móc đáy Điều khiển độc lập bằng motor Bộ móc gấp hoàn thiện và các móc xoắn để gấp các tay gấp đáy một cách mượt mà và chính xác Điều chỉnh lực căng các móc Bộ phụ kiện móc đáy kiểu B-type. Cài đặt nhanh chóng và dễ dàng Bộ phận dán keo Hệ thống bôi keo điện tiêu chuẩn phía trên, bôi keo lạnh bằng 3 súng. Các tùy chọn cấu hình hệ thống keo trên khác theo yêu cầu Hai bể keo dưới (trái và phải) Dễ dàng tháo và vệ sinh Bộ phận gấp Điều khiển độc lập bằng motor Gấp đường thứ hai và thứ tư một cách mượt mà và chính xác Đai gấp ngoài có thể điều chỉnh 180° với nhiều tốc độ, được điều khiển bởi các bánh xe chặn và định vị trái phải Cơ chế truyền vô cấp (biến tần, servo-motor), hai chiều trái phải. Dễ tiếp cận Thiết bị gấp hộp mini Bộ phận đai vận chuyển Điều khiển độc lập bằng motor Điều chỉnh độ dài bằng các bộ phận cơ khí trên và dưới Cho phép chọn dòng vận chuyển hộp gối đầu và gối đuôi Trang bị hệ thống điều chỉnh lực căng đai tự động Các bộ phận cơ khí nhận sản phẩm tự động và liên tục giúp sản phẩm đi vào bộ phận ép một cách ngay ngắn Thiết bị căn vuông góc cơ khí giúp đóng đáy hộp một cách chính xác Bộ phận ép Bộ phận ép motor khí nén độc lập Chế độ thủ công và tự động Bộ phận trên có thể di chuyển tới lui theo chiều dài khác nhau của hộp Điều chỉnh áp suất khí nén tùy ý Thiết bị gấp đuôi Hệ thống gấp đuôi motor điện thông minh bằng công nghệ servo-motor Hai trục dẫn động cho phép gấp chính xác các tay gấp cạnh. Hai servo motor độc lập cho mỗi trục Thiết lập nhanh chóng và đơn giản Thiết bị căn góc vuông (tùy chọn) Thiết bị căn vuông góc bằng khí nén trên bộ phận vận chuyển. Bảng nhôm chặn hộp khi đai truyền trên điều chỉnh các sai lệch khi đóng đáy Hộp được thả ra sau khi điều chỉnh Thiết bị căn vuông góc bằng khí nén và motor trên bộ phận ép. Thiết bị ép cạnh, điều chỉnh các hộp một cách vuông vắn khi rơi xuống băng chuyền bên dưới Module cấn/răng cưa (Tùy chọn) Bộ phận răng cưa độc lập điều khiển bằng motor Nằm ngay phía sau bộ phận định vị hông và trước bộ phận gấp Cho phép tạo răng cưa sâu theo yêu cầu",,https://vprintmachinery.com/upload/sanpham/ZP-M46-7254.jpg,,,,
Mực in UV LED,https://vprintmachinery.com/san-pham/Muc-in-UV-LED-156.html, Mực in UV LED Gen5,Giá: Liên hệ,"Mực in phun UV LED Hàn Quốc chất lượng cao có chứng chỉ CE cho các đầu in công nghiệp Ricoh Gen6, Gen 5, Gen 4","Mực UV chất lượng cao giá cạnh tranh từ Hàn Quốc! Các chủ nhà in phun có đang trăn trở với việc dùng mực giá rẻ từ TQ để rồi chất lượng in kém rồi hay phải thay vài chục triệu 1 cái đầu in? Hay phải dừng máy liên tục để lau đầu? Hãy gọi VPrint Machinery Co để dùng mực UV cho đầu Ricoh Gen5, Gen6 đến từ Hàn Quốc chất lượng tốt + giá phải chăng. Mực Hàn Quốc.",,,"https://vprintmachinery.com/upload/hinhthem/mucinuvledkyoceraricoh-9143.jpg, https://vprintmachinery.com/upload/sanpham/muc-in-uv-led-kyocera-ricoh-7202.jpg",,,,
Máy dán hộp 4-6 cạnh hộp offset B 4/6 Series,https://vprintmachinery.com/san-pham/May-dan-hop-46-canh-hop-offset-B-46-Series-258.html, May dan hop ZP-M series,Giá: Liên hệ,"Máy dán hộp tự động, dán hộp 4 cạnh 6 cạnh, tốc độ cao.","VPRINT MACHINERY - GIẢI PHÁP MỚI CHO NGÀNH IN VÀ BAO BÌ Dòng máy cao cấp sử dụng phụ tùng cao cấp từ Đức, Nhật Các kiểu hộp và thông số: Hộp 4 cạnh - hộp 6 cạnh","Bộ phận cấp giấy Bộ điều khiển cấp giấy độc lập với nhiều tốc độ Chức năng điều chỉnh rung xếp chồng giấy Cửa cấp hông điều chỉnh được tối đa theo chiều rộng sản phẩm Bộ phận định vị hông Bộ phận độc lập định vị theo chiều hông đảm bảo sản phẩm vào bộ phận gấp và dán một cách song song tuyệt đối Bộ phận đai vận chuyển Điều khiển độc lập bằng motor Điều chỉnh độ dài bằng các bộ phận cơ khí trên và dưới Cho phép chọn dòng vận chuyển hộp gối đầu và gối đuôi Trang bị hệ thống điều chỉnh lực căng đai tự động Các bộ phận cơ khí nhận sản phẩm tự động và liên tục giúp sản phẩm đi vào bộ phận ép một cách ngay ngắn Thiết bị căn vuông góc cơ khí giúp đóng đáy hộp một cách chính xác Bộ phận gấp Gấp đường thứ hai và thứ tư một cách mượt mà và chính xác Đai gấp ngoài có thể điều chỉnh 180° với nhiều tốc độ, được điều khiển bởi các bánh xe chặn và định vị trái phải Các con lăn áp lực lớn có thể điều chỉnh độ rộng (tùy chọn) Bộ phận đai vận chuyển Có thể điều chỉnh tốc độ thủ công hoặc tự động với sự hỗ trợ của các cảm biến Bộ phận trên có thể di chuyển tới lui theo chiều dài khác nhau của hộp Điều chỉnh áp lực bằng khí nén Bộ phận gấp hông Tay gấp cánh trái lên đến 180° Gấp đường gấp thứ ba lên đến 135° Bộ phận mở đường cấn thứ nhất và thứ ba Bộ phận ép Có thể điều chỉnh tốc độ thủ công hoặc tự động với sự hỗ trợ của các cảm biến Bộ phận trên có thể di chuyển tới lui theo chiều dài khác nhau của hộp Điều chỉnh áp lực bằng khí nén Bộ phận móc đáy Bộ móc gấp hoàn thiện và các móc xoắn để gấp các tay gấp đáy một cách mượt mà và chính xác Bộ phụ kiện móc đáy kiểu B-type Thiết bị gấp đuôi Hai trục dẫn động cho phép gấp chính xác các tay gấp cạnh. Dễ dàng cài đặt thông qua màn hình điều khiển Thiết bị miết góc vuông (tùy chọn) Thiết bị miết vuông góc bằng khí nén và motor trên bộ phận ép. Hai thiết bị được gắn trên đai truyền dòng sản phản được vận chuyển vào bộ phận ép một cách hoàn hảo Thiết bị ép cạnh, điều chỉnh các hộp một cách vuông vắn khi rơi xuống băng chuyền bên dưới Bộ phận dán keo Một bể keo dưới (bên trái) Dễ dàng tháo và vệ sinh Hệ thống bôi keo điện bằng súng phía trên","{""ZP-B850-4/6 corner"": {""Vật liệu phù hợp"": ""Cardboard 210-850gsm Carton sóng E/F"", ""Phương pháp cấp"": ""Tự động liên tục"", ""Tốc độ tối đa"": ""450m/phút"", ""Kích thước tổng"": ""15500x1400x1800mm"", ""Khối lượng"": ""7T"", ""Công suất tiêu thụ"": ""23 KW - 380V, 50Hz"", ""Hộp 4 cạnh A"": ""140-770mm"", ""Hộp 4 cạnh B"": ""60-500mm"", ""Hộp 4 cạnh C"": ""20-120mm"", ""Hộp 6 cạnh A"": ""200-770mm"", ""Hộp 6 cạnh B"": ""80-500mm"", ""Hộp 6 cạnh C"": ""20-200mm""}, ""ZP-B1100-4/6 corner"": {""Vật liệu phù hợp"": ""Cardboard 210-850gsm Carton sóng N/E/F"", ""Phương pháp cấp"": ""Tự động liên tục"", ""Tốc độ tối đa"": ""450m/phút"", ""Kích thước tổng"": ""15500x1700x1800mm"", ""Khối lượng"": ""8T"", ""Công suất tiêu thụ"": ""23 KW - 380V, 50Hz"", ""Hộp 4 cạnh A"": ""180-950mm"", ""Hộp 4 cạnh B"": ""80-800mm"", ""Hộp 4 cạnh C"": ""25-150mm"", ""Hộp 6 cạnh A"": ""300-950mm"", ""Hộp 6 cạnh B"": ""80-800mm"", ""Hộp 6 cạnh C"": ""25-150mm""}}",https://vprintmachinery.com/upload/sanpham/ZP-B-46-6578.jpg,,,,
YD-F2513R5_Máy in UV dạng bàn,https://vprintmachinery.com/san-pham/YDF2513R5May-in-UV-dang-ban-88.html, YD-F2513R5,Giá: Liên hệ,"Máy in UV chất lượng cao khổ máy 2500x1300mm, đầu in công nghiệp Ricoh G5 công nghiệp, máy có độ bền, độ phân giải và tốc độ cao nhất thị trường.","Máy in UV hiệu YOTTA| Máy in trên mọi chất liệu và bề mặt cho quảng cáo và trang trí nội thất VPrint xin giới thiệu dòng máy in UV dạng tấm flatbed hiệu Yotta. Máy được trang bị đầu in Ricoh công nghiệp thế hệ 5, có hệ thống gia nhiệt, hạt mực phun thay đổi từ 7pl đến 35pl nên dễ dàng đạt độ phân giải cao nhất trên thị trường 600x2400dpi, đầu in bằng thép không rỉ có khả năng chống mài mòn cao nên có tuổi thọ lớn có thể lên đến 5 năm. Dòng máy in này với hệ cơ khí được chế tạo ở cấp chính xác cao lên đến mimicromet và được trang bị động cho secvo của Panasonic bền và chính xác nên cho hình ảnh in cực kỳ sắc nét và chính xác. Máy in dùng để in Alu, tủ nhựa, tấm trần, mica, thạch cao, các loại bạt, tranh gạch , tranh kính, tranh canvas 3D/5D ... Máy in UV YD-F2513R5 dạng phẳng flatbed","Tại sao nên chọn máy in UV dạng tấm hiệu Yotta? - Đầu in công nghiệp thế hệ 5 của Ricoh bằng thép không rỉ cho tuổi thọ cao -Độ phân giải (600x2400 dpi) và tốc độ thực tế cao nhất thị trường - Đèn UV LED sản xuất tại Mỹ có hiệu suất cao và tuổi thọ bền (lên đến 30.000 giờ sử dụng) hơn loại đèn UV thủy ngân thông thường - Nhiều màu- từ 4 đến 7 màu c - Máy in đạt chứng chỉ CE, RoHS và sở hữu nhiều bằng sáng chế - Hệ thống tự động chống va chạm để bảo vệ đầu in - Tự động định vị trí và chiều cao vật liệu cần in - Máy được trang bị bàn hút chân không để giữ ổn định vật liệu mỏng, bản hút chân không được chi thành từng vùng để tối ưu việc sử dụng - Hệ thống áp suất âm giúp hình ảnh in sống động hơn đồng thời tiết kiệm mực in và bảo vệ đầu in - Tự động định vị trí và chiều cao vật liệu cần in cho phép in lên đến cao đến 100 mm ( tùy chọn 450mm) - Máy có độ chính xác cao lên đến 1micromet cho phần cơ khí - Động cơ servo của Panasonic cho phép điều khiển chính xác các chuyển động - Hệ thống đường ray đôi Hiwin của Đài Loan giúp tăng độ ổn định và giảm độ ồn - Máy được thiết kế để có thể hoạt động 24/7","{""Model"": ""YD-F2513R5"", ""Khích thước vùng in"": ""2500x1300mm"", ""Số đầu in"": ""từ 4-8 cái (cho 4 đến 8 màu)"", ""Chế độ in"": ""Một chiều/hai chiều"", ""Đầu in/Công nghệ in"": ""Ricoh Gen5/ Grey level Piezo"", ""Mực"": ""Lm, Lc, Y,M,C,K (tùy chọn)/Mục UV thân thiện môi trường (No VOC)"", ""Mực đặc biệt"": ""Mực UV trắng hoặc mực UV vecni"", ""Độ phân giải"": ""600x2400dpi"", ""Phần mềm"": ""PhotoPrint"", ""File format"": ""Adobe Postcript level3, PDF, JPEG, TIFF, EPS, AI"", ""Chiều dầy vật liệu"": ""100mm"", ""Vật liệu có thể in"": ""đá, gỗ, vải, kim loại, thủy tinh... cứng và mềm"", ""Nguồn yêu cầu"": ""AC 220V, 50/60Hz, 6KW"", ""Kích thước máy (LxWxH), khối lượng"": ""4450x2115x1310mm, 1300Kg""}","https://vprintmachinery.com/upload/hinhthem/2513r5yottauvprinter-434.JPG, https://vprintmachinery.com/upload/sanpham/2513r5-yotta-uv-printer-6935.JPG",,,,
26 Models,https://vprintmachinery.com/san-pham/26-Models-319.html,,Giá: Liên hệ,"Máy ghi bản CRON Offset CTP 26 series, phù hợp với in thương mai khổ nhỏ, và in nhãn hàng","Ngành công nghiệp in ấn và in nhãn tốc độ nhỏ là ngành in các tài liệu in được tùy chỉnh nhanh chóng, theo lô nhỏ, được cá nhân hóa. Hoạt động kinh doanh của nó thường được thực hiện ở các cửa hàng hình ảnh và văn bản, cửa hàng in ấn, cũng như cửa hàng quảng cáo. Nó linh hoạt trong việc chấp nhận đơn đặt hàng và có thể tùy chỉnh số lượng nhỏ. Các tính năng tùy biến, hiệu quả và tốc độ ngày càng nhanh. Đặc biệt là về mặt tiếp thị chính xác trong kinh doanh (sản xuất đấu thầu, nhãn hiệu, thư từ, vật liệu, bản vẽ kỹ thuật, giải pháp kinh doanh tùy chỉnh, v.v.) và nhu cầu cá nhân hóa (album ảnh cá nhân hóa, album ảnh, bưu thiếp, album kỷ niệm, v.v.), nhu cầu đối với yêu cầu về chất lượng in ấn tinh tế và chất lượng cao, ngày càng có nhiều công ty in ấn và in nhãn hàng nhỏ sẵn sàng lựa chọn thiết bị làm bản trực tiếp ổn định, bền bỉ, tiết kiệm và có hiệu quả in ấn tuyệt vời. 26 series CTP Máy làm bản CTP dòng 26 của CRON là đối tác tuyệt vời cho hoạt động in nhanh thương mại nhỏ. Nó là một mô hình cổ điển để in nhanh thương mại nhỏ. Nó có nguồn gốc từ công nghệ cốt lõi tương tự của CRON. Nó có cấu trúc nhỏ gọn, bước ghi rất nhỏ và độ ổn định cao. Phiên bản mỏng 0,15mm có lợi thế đầu ra lớn hơn và khả năng sinh lời cao. Đây là một trong những lựa chọn tốt nhất để sản xuất hiệu quả cao và vận hành chi phí thấp. Thiết bị ghi bản in trực tiếp CTP dòng 26 của CRON nhỏ gọn, ổn định và bền bỉ, đáp ứng nhu cầu làm bản in tinh tế của các công ty in nhãn và in tốc độ thấp. Đây là đối tác tốt nhất cho in nhanh thương mại nhỏ và hoàn toàn phù hợp với các máy in nhanh thương mại.","Độ phẳng trống quang cực cao, Hệ thống ray dẫn hướng hình chữ V Điều khiển Kỹ thuật số Trống chống rò rỉ không khí/chân không Hệ thống định vị 3 điểm Hệ thống LaBoo hỗ trợ từ xa","{""Bản"": ""Max. 670 x 570 mm / Min. 240 x 240 mm"", ""Nguồn điện"": ""Single phase AC 220V ± 5% 50/60Hz Rated power 5.3KW"", ""Kích thước"": ""W x L x H: 1400 x 1110 x 1055 mm"", ""Khối lượng"": ""1070kg""}",https://vprintmachinery.com/upload/sanpham/Model-26-8970.JPG,,,,
Máy cắt bế KTS tự động VP-1007A,https://vprintmachinery.com/san-pham/May-cat-be-KTS-tu-dong-VP1007A-324.html, VP-1007A,Giá: Liên hệ,"Máy cắt bế phẳng thông minh cấp tự động thế hệ mới VP-1007A được nâng cấp hệ thống công cụ và được cải tiến nhằm đáp ứng với nhu cầu của người dùng trong ngành IN KTS, BAO BÌ & QUẢNG CÁO VN.","Máy cắt bế thông minh tự động dạng phẳng (flatbed) với hệ thống cấp vật liệu hoàn toàn tự động có khả năng nâng và truyền vật liệu bằng các cụm hút chân không. Được trang bị nhiều công cụ giúp thực hiện các công việc như cắt rời, bế demi, cấn, vẽ layout... Phù hợp với nhu cầu làm mẫu và sản xuất các đơn hàng ngắn cho NGÀNH IN, BAO BÌ và QUẢNG CÁO. Máy được hãng IECHO sản xuất riêng OEM cho thị trường VN và VPrint là đại diện độc quyền. Dòng máy cắt b ế phẳng kỹ thuật số cấp tự động VP-1007A, là một hệ thống cắt b ế kỹ thuật số thông minh được thiết kế cho ngành đồ họa, quảng cáo, in ấn / bao bì, thiết kế biển hiệu và sản xuất đơn hàng ngắn. Với hệ thống điều khiển chuyển động 6 trục tốc độ cao tiên tiến, có thể thực hiện một cách nhanh chóng và chính xác các công việc như cắt; phay; cấn; cắt răng cưa; đục lỗ; đánh dấu; ... Tất cả các chức năng trên cùng một máy. Máy được trang bị hệ thống cấp vật liệu tự động, hệ thống định vị bằng Camera HD CCD HD, giúp việc sản xuất diễn ra hoàn toàn tự động. Nó có thể hỗ trợ khách hàng sản xuất dễ dàng các sản phẩm gia tăng giá trị một cách chính xác, sáng tạo, độc đáo, chất lượng cao trong thời gian và không gian hạn chế.","Được thiết kế riêng phù hợp với ngành in off-set với khổ giấy A0 / B1 Công cụ cắt thường DK được nâng cấp lên một tầm cáo mới, Nâng hạ theo độ chính xác bằng motor Servo Hỗ trợ các công cụ thông thường nhằm tăng khả năng linh hoạt của máy. Ngoài ra máy còn có thể kết hợp với các công cụ lớn như EOT, KISSCUT, IECHOCUT, ... Dao rung điện có thể cắt được độ dày lên tới 16mm Hệ thống cấp liệu được nâng cấp","{""MODEL MÁY"": ""VP-1007A"", ""VÙNG CẮT"": ""1000*707mm"", ""KHỔ GIẤY CHO PHÉP"": ""A1/A2/A3/A4 ; B1/B2/B3/B4"", ""DIỆN TÍCH SÀN"": ""D 2890 x R 1400 x C 1200 D 2150 x R 1400 x C 1200 (Khi chưa gắn thêm phụ kiện máy)"", ""DIỆN TÍCH ĐÓNG THÙNG"": ""2280x1620x1570"", ""ĐỘ CAO VÀ CÂN NẶNG CHO PHÉP BÀN CẤP LIỆU"": ""400mm / 260kg"", ""TÙY CHỌN"": ""Màn hình LCD, bộ cấp cuộn"", ""HỆ THỐNG GIỮ VẬT LIỆU"": ""Hút chân không"", ""CẤU HÌNH CÔNG CỤ"": ""- 4 Công cụ cố định: DK 0.9mm, DK 1.5mm, cấn, dao rung EOT1 - Hệ thống CCD, đèn laser - Công cụ lớn tùy chọn: UTC, KISSCUT, EOT, ...."", ""TỐC ĐỘ CẮT TỐI ĐA"": ""1200 mm/s (Phụ thuộc vào vật liệu và công cụ)"", ""ĐỘ DÀY CẮT TỐI ĐA"": ""16 mm"", ""DUNG SAI MÁY"": ""± 0.1 mm"", ""ĐỊNH DẠNG FILE HỖ TRỢ"": ""DXF, BRG"", ""CỔNG KẾT NỐI"": ""USB"", ""ÁP SUẤT KHÍ NÉN"": ""0.6 Mpa"", ""KHỐI LƯỢNG MÁY"": ""700 kg"", ""VÙNG HÚT"": ""2 vùng, 2 bơm hút chân không"", ""ĐIỆN ÁP CHO PHÉP"": ""1 pha 220VAC hoặc 3 pha 380VAC"", ""MÔI TRƯỜNG HOẠT ĐỘNG"": ""Nhiệt độ 0°C - 30°C, độ ẩm 20% - 80% RH""}",,,,,
